<!ELEMENT dblp (article|inproceedings|proceedings|book|incollection|phdthesis|mastersthesis|www)*>
<!ELEMENT article       (author|editor|title|booktitle|pages|year|address|journal|volume|number|month|url|ee|cdrom|cite|publisher|note|crossref|isbn|series|school|chapter)*>
<!ELEMENT inproceedings (author|editor|title|booktitle|pages|year|address|journal|volume|number|month|url|ee|cdrom|cite|publisher|note|crossref|isbn|series|school|chapter)*>
<!ELEMENT proceedings   (author|editor|title|booktitle|pages|year|address|journal|volume|number|month|url|ee|cdrom|cite|publisher|note|crossref|isbn|series|school|chapter)*>
<!ELEMENT book          (author|editor|title|booktitle|pages|year|address|journal|volume|number|month|url|ee|cdrom|cite|publisher|note|crossref|isbn|series|school|chapter)*>
<!ELEMENT incollection  (author|editor|title|booktitle|pages|year|address|journal|volume|number|month|url|ee|cdrom|cite|publisher|note|crossref|isbn|series|school|chapter)*>
<!ELEMENT phdthesis     (author|editor|title|booktitle|pages|year|address|journal|volume|number|month|url|ee|cdrom|cite|publisher|note|crossref|isbn|series|school|chapter)*>
<!ELEMENT mastersthesis (author|editor|title|booktitle|pages|year|address|journal|volume|number|month|url|ee|cdrom|cite|publisher|note|crossref|isbn|series|school|chapter)*>
<!ELEMENT www           (author|editor|title|booktitle|pages|year|address|journal|volume|number|month|url|ee|cdrom|cite|publisher|note|crossref|isbn|series|school|chapter)*>
<!ELEMENT author    (#PCDATA)>
<!ELEMENT editor    (#PCDATA)>
<!ELEMENT address   (#PCDATA)>
<!ELEMENT title     (sub|sup|i|tt|ref)*>
<!ELEMENT booktitle (#PCDATA)>
<!ELEMENT pages     (#PCDATA)>
<!ELEMENT year      (#PCDATA)>
<!ELEMENT journal   (#PCDATA)>
<!ELEMENT volume    (#PCDATA)>
<!ELEMENT number    (#PCDATA)>
<!ELEMENT month     (#PCDATA)>
<!ELEMENT url       (#PCDATA)>
<!ELEMENT ee        (#PCDATA)>
<!ELEMENT cdrom     (#PCDATA)>
<!ELEMENT cite      (#PCDATA)>
<!ELEMENT school    (#PCDATA)>
<!ELEMENT publisher (#PCDATA)>
<!ELEMENT note      (#PCDATA)>
<!ELEMENT crossref  (#PCDATA)>
<!ELEMENT isbn      (#PCDATA)>
<!ELEMENT chapter   (#PCDATA)>
<!ELEMENT series    (#PCDATA)>
<!ELEMENT ref (sub|sup|i|tt|ref)*>
<!ELEMENT sup (sub|sup|i|tt|ref)*>
<!ELEMENT sub (sub|sup|i|tt|ref)*>
<!ELEMENT i   (sub|sup|i|tt|ref)*>
<!ELEMENT tt  (sub|sup|i|tt|ref)*>