<?xml version="1.0" encoding="UTF-8"?>
<!DOCTYPE dblp SYSTEM "data/dblp/dblp.dtd">
<dblp>
<article>
<author></author>
<editor></editor>
<title>
<sub></sub>
<sup></sup>
<i></i>
<tt></tt>
<ref></ref>
</title>
<booktitle></booktitle>
<pages></pages>
<year></year>
<address></address>
<journal></journal>
<volume></volume>
<number></number>
<month></month>
<url></url>
<ee></ee>
<cdrom></cdrom>
<cite></cite>
<publisher></publisher>
<note></note>
<crossref></crossref>
<isbn></isbn>
<series></series>
<school></school>
<chapter></chapter>
</article>
<inproceedings>
<author></author>
<editor></editor>
<title>
<sub></sub>
<sup></sup>
<i></i>
<tt></tt>
<ref></ref>
</title>
<booktitle></booktitle>
<pages></pages>
<year></year>
<address></address>
<journal></journal>
<volume></volume>
<number></number>
<month></month>
<url></url>
<ee></ee>
<cdrom></cdrom>
<cite></cite>
<publisher></publisher>
<note></note>
<crossref></crossref>
<isbn></isbn>
<series></series>
<school></school>
<chapter></chapter>
</inproceedings>
<proceedings>
<author></author>
<editor></editor>
<title>
<sub></sub>
<sup></sup>
<i></i>
<tt></tt>
<ref></ref>
</title>
<booktitle></booktitle>
<pages></pages>
<year></year>
<address></address>
<journal></journal>
<volume></volume>
<number></number>
<month></month>
<url></url>
<ee></ee>
<cdrom></cdrom>
<cite></cite>
<publisher></publisher>
<note></note>
<crossref></crossref>
<isbn></isbn>
<series></series>
<school></school>
<chapter></chapter>
</proceedings>
<book>
<author></author>
<editor></editor>
<title>
<sub></sub>
<sup></sup>
<i></i>
<tt></tt>
<ref></ref>
</title>
<booktitle></booktitle>
<pages></pages>
<year></year>
<address></address>
<journal></journal>
<volume></volume>
<number></number>
<month></month>
<url></url>
<ee></ee>
<cdrom></cdrom>
<cite></cite>
<publisher></publisher>
<note></note>
<crossref></crossref>
<isbn></isbn>
<series></series>
<school></school>
<chapter></chapter>
</book>
<incollection>
<author></author>
<editor></editor>
<title>
<sub></sub>
<sup></sup>
<i></i>
<tt></tt>
<ref></ref>
</title>
<booktitle></booktitle>
<pages></pages>
<year></year>
<address></address>
<journal></journal>
<volume></volume>
<number></number>
<month></month>
<url></url>
<ee></ee>
<cdrom></cdrom>
<cite></cite>
<publisher></publisher>
<note></note>
<crossref></crossref>
<isbn></isbn>
<series></series>
<school></school>
<chapter></chapter>
</incollection>
<phdthesis>
<author></author>
<editor></editor>
<title>
<sub></sub>
<sup></sup>
<i></i>
<tt></tt>
<ref></ref>
</title>
<booktitle></booktitle>
<pages></pages>
<year></year>
<address></address>
<journal></journal>
<volume></volume>
<number></number>
<month></month>
<url></url>
<ee></ee>
<cdrom></cdrom>
<cite></cite>
<publisher></publisher>
<note></note>
<crossref></crossref>
<isbn></isbn>
<series></series>
<school></school>
<chapter></chapter>
</phdthesis>
<mastersthesis>
<author></author>
<editor></editor>
<title>
<sub></sub>
<sup></sup>
<i></i>
<tt></tt>
<ref></ref>
</title>
<booktitle></booktitle>
<pages></pages>
<year></year>
<address></address>
<journal></journal>
<volume></volume>
<number></number>
<month></month>
<url></url>
<ee></ee>
<cdrom></cdrom>
<cite></cite>
<publisher></publisher>
<note></note>
<crossref></crossref>
<isbn></isbn>
<series></series>
<school></school>
<chapter></chapter>
</mastersthesis>
<www>
<author></author>
<editor></editor>
<title>
<sub></sub>
<sup></sup>
<i></i>
<tt></tt>
<ref></ref>
</title>
<booktitle></booktitle>
<pages></pages>
<year></year>
<address></address>
<journal></journal>
<volume></volume>
<number></number>
<month></month>
<url></url>
<ee></ee>
<cdrom></cdrom>
<cite></cite>
<publisher></publisher>
<note></note>
<crossref></crossref>
<isbn></isbn>
<series></series>
<school></school>
<chapter></chapter>
</www>
</dblp>
